{
  "fixtureVersion": "2.0.0",
  "caseId": "P101-AMEF-RCM-002",
  "name": "P-101 — Aplicación de biblioteca AMEF/RCM a bomba centrífuga de agua de refrigeración",
  "disclaimer": "Caso ilustrativo para validación conceptual. Los valores, umbrales, costes, frecuencias, roles y decisiones no constituyen una instrucción de mantenimiento aprobada.",
  "engineeringLibrary": {
    "fmeaDefinition": {
      "fmeaDefinitionId": "FMEA-CWPUMP-001",
      "code": "FMEA-CWPUMP-001",
      "name": "Bomba centrífuga de servicio de agua de refrigeración",
      "description": "Biblioteca reusable de ingeniería para bombas centrífugas de servicio de agua de refrigeración.",
      "equipmentTypeRef": "EQUIPTYPE-CENTRIFUGAL-PUMP",
      "functionalScopeRef": "FUNC-CW-TRANSFER",
      "ownerRole": "Reliability Engineering",
      "lifecycleStatus": "active"
    },
    "fmeaRevision": {
      "fmeaRevisionId": "FMEAR-CWPUMP-001-R1",
      "fmeaDefinitionId": "FMEA-CWPUMP-001",
      "revisionNumber": 1,
      "status": "published",
      "validFrom": "2026-08-01",
      "validTo": null,
      "changeReason": "Fixture inicial library-first para Functional Lab.",
      "sourceRevisionId": null,
      "riskMatrixVersionRef": "DEMO-RISK-5X5-V1",
      "rcmLogicVersionRef": "DEMO-RCM-LOGIC-V1",
      "publishedSnapshotId": "SNAP-FMEAR-CWPUMP-001-R1",
      "validationStatus": "to_validate"
    },
    "functions": [
      {
        "fmeaFunctionId": "FNC-CWPUMP-001",
        "fmeaRevisionId": "FMEAR-CWPUMP-001-R1",
        "sequence": 1,
        "functionType": "main",
        "statement": "Transferir agua de refrigeración cuando el sistema la requiera.",
        "performanceStandard": "Caudal y presión según el contexto operacional de aplicación.",
        "unitRef": null
      },
      {
        "fmeaFunctionId": "FNC-CWPUMP-002",
        "fmeaRevisionId": "FMEAR-CWPUMP-001-R1",
        "sequence": 2,
        "functionType": "secondary",
        "statement": "Contener el fluido y transmitir potencia sin degradación mecánica inaceptable.",
        "performanceStandard": "Sin fuga visible ni condición mecánica fuera de los límites aprobados.",
        "unitRef": null
      }
    ],
    "functionalFailures": [
      {
        "functionalFailureId": "FF-CWPUMP-001",
        "fmeaFunctionId": "FNC-CWPUMP-001",
        "sequence": 1,
        "failureType": "total",
        "statement": "No entregar caudal cuando el sistema requiere servicio."
      },
      {
        "functionalFailureId": "FF-CWPUMP-002",
        "fmeaFunctionId": "FNC-CWPUMP-001",
        "sequence": 2,
        "failureType": "partial",
        "statement": "Entregar un caudal o presión inferior al estándar requerido por el contexto de aplicación."
      },
      {
        "functionalFailureId": "FF-CWPUMP-003",
        "fmeaFunctionId": "FNC-CWPUMP-002",
        "sequence": 1,
        "failureType": "degraded",
        "statement": "Operar con fuga o degradación mecánica fuera del criterio aceptado."
      }
    ],
    "failureModes": [
      {
        "failureModeId": "FM-CWPUMP-001",
        "functionalFailureId": "FF-CWPUMP-003",
        "code": "FM-01",
        "statement": "Degradación del sello mecánico",
        "status": "included",
        "inclusionRationale": "Modo plausible para el tipo de equipo y servicio de referencia.",
        "exclusionRationale": null
      },
      {
        "failureModeId": "FM-CWPUMP-003",
        "functionalFailureId": "FF-CWPUMP-003",
        "code": "FM-03",
        "statement": "Degradación de rodamientos",
        "status": "included",
        "inclusionRationale": "Modo plausible con degradación potencialmente detectable.",
        "exclusionRationale": null
      },
      {
        "failureModeId": "FM-CWPUMP-006",
        "functionalFailureId": "FF-CWPUMP-001",
        "code": "FM-06",
        "statement": "Fallo oculto de equipo de reserva asociado a la función requerida",
        "status": "included",
        "inclusionRationale": "Ejemplo de fallo oculto que requiere evaluación RCM específica.",
        "exclusionRationale": null
      },
      {
        "failureModeId": "FM-CWPUMP-007",
        "functionalFailureId": "FF-CWPUMP-002",
        "code": "FM-07",
        "statement": "Obstrucción parcial en aspiración",
        "status": "included",
        "inclusionRationale": "Puede degradar caudal o presión.",
        "exclusionRationale": null
      },
      {
        "failureModeId": "FM-CWPUMP-009",
        "functionalFailureId": "FF-CWPUMP-003",
        "code": "FM-09",
        "statement": "Desalineación del tren rotativo",
        "status": "included",
        "inclusionRationale": "Puede contribuir a vibración y degradación de rodamientos.",
        "exclusionRationale": null
      }
    ],
    "failureCauses": [
      {
        "failureCauseId": "FC-CWPUMP-003-01",
        "failureModeId": "FM-CWPUMP-003",
        "causeType": "degradation_mechanism",
        "statement": "Lubricación inadecuada o degradada.",
        "evidenceRef": "EVID-LIB-003"
      },
      {
        "failureCauseId": "FC-CWPUMP-003-02",
        "failureModeId": "FM-CWPUMP-003",
        "causeType": "mechanical_condition",
        "statement": "Carga adicional inducida por desalineación.",
        "evidenceRef": "EVID-LIB-004"
      }
    ],
    "failureEffects": [
      {
        "failureEffectId": "FE-CWPUMP-003-01",
        "failureModeId": "FM-CWPUMP-003",
        "effectLevel": "local",
        "sequence": 1,
        "statement": "Aumento progresivo de vibración y temperatura en el apoyo.",
        "evidenceRef": "EVID-LIB-003"
      },
      {
        "failureEffectId": "FE-CWPUMP-003-02",
        "failureModeId": "FM-CWPUMP-003",
        "effectLevel": "system",
        "sequence": 2,
        "statement": "Pérdida de estabilidad mecánica y posible daño secundario en sello y acoplamiento.",
        "evidenceRef": "EVID-LIB-004"
      },
      {
        "failureEffectId": "FE-CWPUMP-003-03",
        "failureModeId": "FM-CWPUMP-003",
        "effectLevel": "operational",
        "sequence": 3,
        "statement": "Reducción de capacidad o parada no planificada del equipo aplicado.",
        "evidenceRef": null
      }
    ],
    "consequenceAssessments": [
      {
        "consequenceAssessmentId": "CA-CWPUMP-003-01",
        "failureModeId": "FM-CWPUMP-003",
        "operationalContextProfileRef": "CTXPROFILE-CW-CONTINUOUS",
        "riskMatrixVersionRef": "DEMO-RISK-5X5-V1",
        "consequenceCategory": "operational",
        "severityValue": 4,
        "occurrenceValue": 3,
        "detectionValue": 3,
        "calculatedRiskResult": "DEMO-RISK-HIGH",
        "humanAssessment": "high",
        "rationale": "Valoración demostrativa para revisar el comportamiento del Functional Lab.",
        "evidenceRefs": ["EVID-LIB-003", "EVID-LIB-004"],
        "validationStatus": "to_validate"
      }
    ],
    "rcmAssessments": [
      {
        "rcmAssessmentId": "RCM-CWPUMP-003-01",
        "failureModeId": "FM-CWPUMP-003",
        "consequenceAssessmentId": "CA-CWPUMP-003-01",
        "decisionLogicVersionRef": "DEMO-RCM-LOGIC-V1",
        "systemRecommendation": "condition_based_maintenance",
        "humanDecision": "condition_based_maintenance",
        "overrideReason": null,
        "authorityRole": "Reliability + Maintenance + Operations",
        "status": "approved_for_fixture",
        "answers": [
          {
            "answerId": "RCMA-CWPUMP-003-01",
            "questionRef": "RCMQ-EVIDENT",
            "sequence": 1,
            "answer": "yes",
            "rationale": "El deterioro puede manifestarse durante operación normal.",
            "evidenceRefs": []
          },
          {
            "answerId": "RCMA-CWPUMP-003-02",
            "questionRef": "RCMQ-DETECTABLE",
            "sequence": 2,
            "answer": "yes",
            "rationale": "El fixture asume degradación detectable por tendencia de vibración/temperatura.",
            "evidenceRefs": ["EVID-LIB-003"]
          },
          {
            "answerId": "RCMA-CWPUMP-003-03",
            "questionRef": "RCMQ-PF",
            "sequence": 3,
            "answer": "45 days",
            "rationale": "Hipótesis demostrativa a validar; no estándar corporativo.",
            "evidenceRefs": ["EVID-LIB-003"]
          }
        ]
      }
    ],
    "maintenanceTasks": [
      {
        "maintenanceTaskId": "MT-CWPUMP-001",
        "fmeaRevisionId": "FMEAR-CWPUMP-001-R1",
        "code": "MT-01",
        "name": "Monitorizar condición mecánica del tren rotativo",
        "objective": "Detectar degradación compatible con fallo de rodamientos o desalineación antes del fallo funcional.",
        "maintenanceTypeRef": "condition_based",
        "activityRef": "condition_monitoring",
        "techniqueRef": "vibration_temperature",
        "triggerBasis": "pf_interval",
        "defaultIntervalValue": 21,
        "defaultIntervalUnit": "days",
        "intervalBasisRef": "DEMO-PF-HYPOTHESIS-45D",
        "executionStateRequirementRef": "running",
        "disciplineRef": "mechanical",
        "executorRoleRef": "predictive_maintenance_technician",
        "procedureRef": "PROC-CWPUMP-VIB-001-R1",
        "inspectionFormatRef": "IF-CWPUMP-VIB-001-R1",
        "status": "approved_for_fixture"
      },
      {
        "maintenanceTaskId": "MT-CWPUMP-002",
        "fmeaRevisionId": "FMEAR-CWPUMP-001-R1",
        "code": "MT-02",
        "name": "Verificar alineación del tren cuando la condición lo requiera",
        "objective": "Confirmar o descartar desalineación como contribuyente a degradación mecánica.",
        "maintenanceTypeRef": "condition_triggered",
        "activityRef": "inspection",
        "techniqueRef": "alignment_check",
        "triggerBasis": "condition_trigger",
        "defaultIntervalValue": null,
        "defaultIntervalUnit": null,
        "intervalBasisRef": null,
        "executionStateRequirementRef": "stopped",